1,"I love this product! It's amazing.","Positive"
2,"This is the worst experience ever.","Negative"
3,"It's okay, but could be better.","Neutral"
4,"Absolutely fantastic service!","Positive"
5,"I hate this so much.","Negative"
6,"This is just alright.","Neutral"
7,"Best purchase I've made.","Positive"
8,"Terrible quality, I'm disappointed.","Negative"
9,"It's fine, nothing special.","Neutral"
10,"Wonderful experience overall.","Positive"
11,"I wouldn't recommend it.","Negative"
12,"Decent, but could use improvements.","Neutral"
13,"Exceptional quality!","Positive"
14,"Awful, never buying again.","Negative"
15,"Mediocre at best.","Neutral"
16,"Highly satisfied with this product.","Positive"
17,"This is a disaster.","Negative"
18,"It's average, not great.","Neutral"
19,"Great value for money.","Positive"
20,"Really bad service.","Negative"
21,"Just okay, not memorable.","Neutral"
22,"Top-notch, exceeded expectations.","Positive"
23,"Horrible, waste of money.","Negative"
24,"Could be better, but it's fine.","Neutral"
25,"Super happy with my purchase.","Positive"
26,"Worst customer service.","Negative"
27,"It's good, could be better.","Neutral"
28,"Love it, very pleased.","Positive"
29,"Not worth the price.","Negative"
30,"Just average, nothing special.","Neutral"
31,"Delighted with the quality.","Positive"
32,"Extremely poor experience.","Negative"
33,"It's decent, nothing extraordinary.","Neutral"
34,"Very impressed with the results.","Positive"
35,"This product is a joke.","Negative"
36,"Fairly okay, could improve.","Neutral"
37,"Truly outstanding product!","Positive"
38,"Disgusted with the quality.","Negative"
39,"Average, but acceptable.","Neutral"
40,"Totally love it, fantastic!","Positive"
41,"Very disappointing.","Negative"
42,"It’s passable, not excellent.","Neutral"
43,"Simply amazing, great job!","Positive"
44,"Unsatisfactory experience.","Negative"
45,"It's alright, nothing more.","Neutral"
46,"Superb quality, highly recommend.","Positive"
47,"Really bad, very upset.","Negative"
48,"It's fine, could be better.","Neutral"
49,"Love the product, will buy again.","Positive"
50,"Not happy with this.","Negative"
51,"It’s okay, not great.","Neutral"
52,"Great purchase, very happy.","Positive"
53,"Very poor quality.","Negative"
54,"It’s alright, satisfactory.","Neutral"
55,"Outstanding service, love it!","Positive"
56,"Horrible, very upset.","Negative"
57,"Decent, acceptable.","Neutral"
58,"Excellent, met my expectations.","Positive"
59,"Terrible, regrettable decision.","Negative"
60,"It's okay, nothing impressive.","Neutral"
61,"Completely satisfied, great job!","Positive"
62,"Really bad quality.","Negative"
63,"Acceptable, nothing more.","Neutral"
64,"Amazing, worth every penny.","Positive"
65,"Not good at all.","Negative"
66,"It's alright, adequate.","Neutral"
67,"Very pleased with this.","Positive"
68,"Really disappointed.","Negative"
69,"Fairly okay, could improve.","Neutral"
70,"Best thing I've bought.","Positive"
71,"Extremely poor.","Negative"
72,"It's fine, decent.","Neutral"
73,"Excellent product, love it!","Positive"
74,"Awful, hate it.","Negative"
75,"Adequate, nothing special.","Neutral"
76,"Superb, highly recommend.","Positive"
77,"Terribly bad.","Negative"
78,"It's alright, but not great.","Neutral"
79,"Great quality, very happy.","Positive"
80,"Not worth it, very bad.","Negative"
81,"It’s decent, could be better.","Neutral"
82,"Very happy with this product.","Positive"
83,"Really poor, very upset.","Negative"
84,"It's acceptable, not great.","Neutral"
85,"Simply wonderful!","Positive"
86,"Absolutely terrible.","Negative"
87,"It’s okay, not great.","Neutral"
88,"Extremely satisfied with the results.","Positive"
89,"Very bad experience.","Negative"
90,"It’s alright, adequate.","Neutral"
91,"Exceptional, very pleased.","Positive"
92,"Horrible, never again.","Negative"
93,"It’s okay, could be better.","Neutral"
94,"Fantastic, exceeded my expectations.","Positive"
95,"Not happy with this at all.","Negative"
96,"It’s okay, but not great.","Neutral"
97,"Superb quality, really impressed.","Positive"
98,"Very poor service.","Negative"
99,"Acceptable, nothing special.","Neutral"
100,"Wonderful product, highly satisfied.","Positive"